<?xml version="1.0" encoding="UTF-8" standalone="yes"?>
<!-- edited with XMLSpy v2005 U (http://www.xmlspy.com) by Skulschus (Comelio) -->
<!--W3C Schema generated by XMLSpy v2005 U (http://www.xmlspy.com)-->
<xs:schema xmlns:xs="http://www.w3.org/2001/XMLSchema" elementFormDefault="qualified">
  <xs:element name="Erfolg">
    <xs:complexType>
      <xs:sequence>
        <xs:element name="Stadt" type="xs:string"/>
        <xs:element name="Monat" type="xs:string"/>
        <xs:element ref="Umsatz"/>
      </xs:sequence>
    </xs:complexType>
  </xs:element>
  <xs:element name="Erfolguebersicht">
    <xs:complexType>
      <xs:sequence>
        <xs:element ref="Quartal" maxOccurs="unbounded"/>
      </xs:sequence>
    </xs:complexType>
  </xs:element>
  <xs:element name="Quartal">
    <xs:complexType>
      <xs:sequence>
        <xs:element ref="Erfolg" maxOccurs="unbounded"/>
      </xs:sequence>
      <xs:attribute name="Nr" type="xs:string" use="required"/>
    </xs:complexType>
  </xs:element>
  <xs:element name="Umsatz">
    <xs:complexType>
      <xs:sequence>
        <xs:element name="Gesamt" type="xs:string"/>
        <xs:element name="Neukunden" type="xs:string"/>
      </xs:sequence>
    </xs:complexType>
  </xs:element>
</xs:schema>
